{
  "id": "drop_2026_02",
  "monthLabel": "February 2026",
  "cartSkinId": "cart_rose_quartz_v1",
  "trailId": "trail_heart_glint_v1",
  "badgeId": "badge_rosecrest_v1",
  "frameId": "frame_petal_ring_v1",
  "bonusCoins": 900,
  "claimWindowDays": 45,
  "previewArt": {
    "cartSkinPng": "assets/previews/cart_rose_quartz_v1.png",
    "trailPng": "assets/previews/trail_heart_glint_v1.png",
    "badgePng": "assets/previews/badge_rosecrest_v1.png",
    "framePng": "assets/previews/frame_petal_ring_v1.png"
  }
}