{
  "id": "drop_2026_06",
  "monthLabel": "June 2026",
  "cartSkinId": "cart_ocean_tide_v1",
  "trailId": "trail_marine_pearl_v1",
  "badgeId": "badge_tidemark_v1",
  "frameId": "frame_cerulean_loop_v1",
  "bonusCoins": 800,
  "claimWindowDays": 45,
  "previewArt": {
    "cartSkinPng": "assets/previews/cart_ocean_tide_v1.png",
    "trailPng": "assets/previews/trail_marine_pearl_v1.png",
    "badgePng": "assets/previews/badge_tidemark_v1.png",
    "framePng": "assets/previews/frame_cerulean_loop_v1.png"
  }
}