{
  "id": "drop_2026_01",
  "monthLabel": "January 2026",
  "cartSkinId": "cart_frosted_ore_v1",
  "trailId": "trail_ice_prism_v1",
  "badgeId": "badge_new_dawn_v1",
  "frameId": "frame_glacier_line_v1",
  "bonusCoins": 900,
  "claimWindowDays": 45,
  "previewArt": {
    "cartSkinPng": "assets/previews/cart_frosted_ore_v1.png",
    "trailPng": "assets/previews/trail_ice_prism_v1.png",
    "badgePng": "assets/previews/badge_new_dawn_v1.png",
    "framePng": "assets/previews/frame_glacier_line_v1.png"
  }
}